{
  "meta": {
    "version": "1.0.0"
  },
  "id": "refund-hardening",
  "role": "project",
  "questions": [
    {
      "question": "Why did this project exist (problem statement)?",
      "answer": "Duplicate credits and unclear retries under peak load; regulatory pressure to improve traceability."
    },
    {
      "question": "What was uniquely yours on this project?",
      "answer": "Owned idempotency keys, retry semantics, and joint cutover plan with Risk."
    },
    {
      "question": "What metrics moved post-launch (or what qualitative signal confirmed success)?",
      "answer": "Duplicate credit tickets dropped ~90% in first month; error budget stable through Black Friday."
    }
  ]
}
