{
  "meta": {
    "version": "1.0.0"
  },
  "id": "riverbank-senior-engineer",
  "role": "work",
  "questions": [
    {
      "question": "Exact job title(s) as you want them on the resume (include level if relevant).",
      "answer": "Senior Software Engineer"
    },
    {
      "question": "Employer name (and parent company if known/acquired).",
      "answer": "Riverbank Payments"
    },
    {
      "question": "List up to 10 measurable outcomes tied to your work (metric + before/after or absolute result).",
      "answer": "Across projects: cut refund p95 latency 800ms→220ms; reduced payment Sev2+ incidents ~4/mo→<1/mo; saved ~$200k/yr infra after rightsizing."
    }
  ]
}
